{
  "year": 2026,
  "level": "A2M",
  "school": "EOI Valladolid",
  "language": "es",
  "calendarEmbed": "https://calendar.google.com/calendar/embed?src=99ba2526daef3ee9665b28bd35a739a8345d38429529abadb1504ae266f54837%40group.calendar.google.com&ctz=Europe%2FMadrid&mode=AGENDA",
  "calendarWeek": "https://calendar.google.com/calendar/embed?src=99ba2526daef3ee9665b28bd35a739a8345d38429529abadb1504ae266f54837%40group.calendar.google.com&ctz=Europe%2FMadrid&mode=WEEK",
  "calendarMonth": "https://calendar.google.com/calendar/embed?src=99ba2526daef3ee9665b28bd35a739a8345d38429529abadb1504ae266f54837%40group.calendar.google.com&ctz=Europe%2FMadrid&mode=MONTH",
  "calendarAdd": "https://calendar.google.com/calendar/render?cid=99ba2526daef3ee9665b28bd35a739a8345d38429529abadb1504ae266f54837%40group.calendar.google.com",
  "filesFolder": "https://seafile.biblivre.app/d/bb95955a0c7e4378a712/",
  "filesNote": "La contraseña está en el grupo de WhatsApp."
}
